{
  "schema": "fmea-mining.d9-external-handoff.v1",
  "version": "1.3.33",
  "pilotId": "OEM-PILOT-D9-UNDERCARRIAGE",
  "purpose": "Acompanhamento público de dependência externa para encaminhamento efetivo do pedido OEM D9, sem afirmar que comunicação corporativa ou revisão de campo ocorreu.",
  "github": {
    "repository": "pedromaintenance/fmea-database-mining",
    "issueNumber": 31,
    "issueUrl": "https://github.com/pedromaintenance/fmea-database-mining/issues/31",
    "issueRole": "public_pending_action_tracker_not_an_internal_oem_request",
    "createdIssueIsNotDispatch": true
  },
  "sourceRequest": "data/governance/d9-oem-evidence-request.v1.json",
  "sourceEvidence": "data/quality/oem-d9-evidence-intake.v1.json",
  "sourcePublicResearch": "data/research/d9-public-oem-literature.v1.json",
  "maturity": "public_handoff_prepared_external_dispatch_pending",
  "routing": {
    "internalRecipientSelected": false,
    "authorizedCorporateChannelConfirmed": false,
    "privateTrackingSystemConfirmed": false,
    "requestSent": false,
    "documentReceived": false,
    "independentTechnicalReviewPerformed": false,
    "corporateIdentity": null,
    "privateProtocolId": null,
    "sentAt": null,
    "receivedAt": null
  },
  "processGates": [
    {
      "id": "HND-D9-ROUTE",
      "state": "awaiting_corporate_route",
      "ownerDiscipline": "engenharia_manutencao",
      "action": "Confirmar internamente destinatário autorizado, canal corporativo e repositório privativo de documentação OEM.",
      "evidenceRequirement": "Aprovação interna do canal e da pessoa receptora; registrar dados de contato e comprovação exclusivamente em ambiente privado."
    },
    {
      "id": "HND-D9-DISPATCH",
      "state": "not_sent",
      "ownerDiscipline": "engenharia_manutencao",
      "action": "Encaminhar a solicitação v1.3.31, com identificação real do D9 somente no sistema corporativo autorizado.",
      "evidenceRequirement": "Comprovante de envio e protocolo guardados em sistema privado; a issue pública recebe apenas sinalizador não identificável de andamento."
    },
    {
      "id": "HND-D9-RECEIPT",
      "state": "awaiting_oem_evidence",
      "ownerDiscipline": "engenharia_ativos",
      "action": "Receber referências de mídia, versão e documentos efetivos por série, sem adicionar SIS/OMM, PN, CTS ou serial ao GitHub.",
      "evidenceRequirement": "Relação de objetos sob licença e verificação de efetividade no cofre documental corporativo."
    },
    {
      "id": "HND-D9-REVIEW",
      "state": "awaiting_field_and_independent_review",
      "ownerDiscipline": "engenharia_mecanica",
      "action": "Validar correspondência com conjunto instalado e preparar inspeção segura, medição CTS e revisão independente quando autorizadas.",
      "evidenceRequirement": "Procedimento seguro efetivo, registros de campo rastreáveis e parecer técnico independente, todos armazenados privadamente."
    }
  ],
  "originalGateSnapshot": [
    {
      "evidenceInputId": "serial-prefix",
      "requestId": "REQ-D9-01",
      "originalSourceStatus": "not_supplied",
      "privateEvidenceVerified": false,
      "publicReleaseAllowed": false
    },
    {
      "evidenceInputId": "oem-omm",
      "requestId": "REQ-D9-02",
      "originalSourceStatus": "not_supplied",
      "privateEvidenceVerified": false,
      "publicReleaseAllowed": false
    },
    {
      "evidenceInputId": "oem-parts",
      "requestId": "REQ-D9-03",
      "originalSourceStatus": "not_verified",
      "privateEvidenceVerified": false,
      "publicReleaseAllowed": false
    },
    {
      "evidenceInputId": "oem-bolting",
      "requestId": "REQ-D9-04",
      "originalSourceStatus": "not_verified",
      "privateEvidenceVerified": false,
      "publicReleaseAllowed": false
    },
    {
      "evidenceInputId": "oem-cts",
      "requestId": "REQ-D9-05",
      "originalSourceStatus": "not_verified",
      "privateEvidenceVerified": false,
      "publicReleaseAllowed": false
    },
    {
      "evidenceInputId": "sap-master",
      "requestId": "REQ-D9-06",
      "originalSourceStatus": "not_verified",
      "privateEvidenceVerified": false,
      "publicReleaseAllowed": false
    },
    {
      "evidenceInputId": "field-review",
      "requestId": "REQ-D9-07",
      "originalSourceStatus": "not_performed",
      "privateEvidenceVerified": false,
      "publicReleaseAllowed": false
    }
  ],
  "releaseBoundary": {
    "githubIssueCannotStoreLicensedOEM": true,
    "githubIssueCannotStoreMachineSerial": true,
    "githubIssueCannotStoreSapIdentifiers": true,
    "closingDispatchIssueDoesNotApproveSevenOemGates": true,
    "publicStatusCannotClaimActualDispatchBeforePrivateReceipt": true,
    "fieldWorkNeedsOemEffectivityAndSafePermit": true,
    "knowledgeCoreCannotBePromotedAutomatically": true,
    "requiredHumanReviewRemainsExternal": true
  },
  "publicProgress": {
    "preparedRequest": true,
    "publicTrackingIssueCreated": true,
    "externalRecipientConfirmed": false,
    "requestActuallySent": false,
    "sourceDocsActuallyObtained": 0,
    "fieldInspectionsActuallyPerformed": 0,
    "independentOEMApprovals": 0
  },
  "externalNextDecision": "Definir no ambiente corporativo o destinatário institucional e canal de tramitação, enviar a solicitação e conservar comprovante privado. Não publicar pessoa, série, documentos ou protocolo interno no GitHub.",
  "coreFmeaChainsPreserved": 24,
  "ontologyMechanismsPreserved": 15
}
